section,division,group,class,subclass,text_of,text
C,28,281,2818,,class,Manufacture of power-driven hand tools
C,28,281,2818,28180,subclass,Manufacture of power-driven hand tools
C,28,281,2819,,class,Manufacture of other general-purpose machinery
C,28,281,2819,28191,subclass,"Manufacture of refrigerating or freezing equipment f industrial use, including assemblies of major components"
C,28,281,2819,28192,subclass,"Manufacture of air-conditioning machines, including motor vehicles air-conditioners"
C,28,281,2819,28193,subclass,"Manufacture of fire extinguishers and other equipment for projecting, dispersing or spraying liquids or powders whether or not hand-operated, including sand blasting machines, stream cleaning machines etc."
C,28,281,2819,28194,subclass,Manufacture of weighing machinery (other than sensitive laboratory balances)
C,28,281,2819,28195,subclass,Manufacture of filtering and purifying machinery or apparatus for liquids and gases
C,28,281,2819,28199,subclass,"Manufacture of other general purpose machinery n.e.c. ( fans intended for industrial applications, exhaust hoods for commercial, laboratory or industrial use; calendering or other rolling machines other than for metals or glass; gaskets and similar j"
C,28,282,,,group,Manufacture of special-purpose machinery
C,28,282,2821,,class,Manufacture of agricultural and forestry machinery
C,28,282,2821,28211,subclass,Manufacture of tractors used in agriculture and forestry
C,28,282,2821,28212,subclass,"Manufacture of ploughs, manure spreaders, seeders, harrows and similar agricultural machinery for soil preparation, planting or fertilizing, harvesting or threshing machinery"
C,28,282,2821,28213,subclass,Manufacture of spraying machinery for agricultural use
C,28,282,2821,28219,subclass,Manufacture of other agricultural and forestry machinery n.e.c.
C,28,282,2822,,class,Manufacture of metal-forming machinery and machine tools
C,28,282,2822,28221,subclass,"Manufacture of machine tools for turning, drilling, milling, shaping, planning, boring, grinding etc."
C,28,282,2822,28222,subclass,Manufacture of electroplating machinery
C,28,282,2822,28223,subclass,Manufacture of parts and accessories for the machine tools listed above
C,28,282,2822,28229,subclass,Manufacture of metal-forming machinery and machine tools n.e.c
C,28,282,2823,,class,Manufacture of machinery for metallurgy
C,28,282,2823,28230,subclass,Manufacture of machinery for metallurgy
C,28,282,2824,,class,"Manufacture of machinery for mining, quarrying and construction"
C,28,282,2824,28241,subclass,Manufacture of continuous-action elevators and conveyors for underground use
C,28,282,2824,28242,subclass,"Manufacture of boring, cutting, sinking and tunnelling machinery (whether or not for underground use)"
C,28,282,2824,28243,subclass,"Manufacture of earth-moving machinery (bulldozers, angle-dozers, graders, scrapers, levellers, mechanical shovels, shovel loaders, off-road dumping"
C,28,282,2824,28244,subclass,Manufacture of tracklaying tractors and tractors used in construction or mining
C,28,282,2824,28245,subclass,"Manufacture of concrete and mortar mixers, piledrivers and pile-extractors, mortar spreaders, bitumen spreaders, concrete surfacing machinery"
C,28,282,2824,28246,subclass,Manufacture of parts and accessories for machinery/equipment used by construction and mining industries
C,28,282,2824,28249,subclass,"Manufacture of other machinery for mining, quarrying and construction n.e.c."
C,28,282,2825,,class,"Manufacture of machinery for food, beverage and tobacco processing"
C,28,282,2825,28251,subclass,Manufacture of machinery for the dairy industry
C,28,282,2825,28252,subclass,Manufacture of machinery for the grain milling industry
C,28,282,2825,28253,subclass,"Manufacture of presses, crushers etc. used to make wine, cider, fruit juices etc."
C,28,282,2825,28254,subclass,"Manufacture of machinery for the bakery industry or for making macaroni, noodles, pasta etc."
C,28,282,2825,28255,subclass,Manufacture of machinery for the extraction or preparation of animal or vegetable fats or oils
C,28,282,2825,28259,subclass,Manufacture of other machinery for the industrial preparation or manufacture of food or drink n.e.c. (including tea or coffee making machines)
C,28,282,2826,,class,"Manufacture of machinery for textile, apparel and leather production"
C,28,282,2826,28261,subclass,"Manufacture of machinery for preparation of textile fibers, spinning machines, machines for preparing textile yarns, weaving machines (looms), including hand looms, knitting machines"
C,28,282,2826,28262,subclass,Manufacture of textile printing machinery
C,28,282,2826,28263,subclass,"Manufacture of machinery for washing, bleaching, dyeing, dressing, finishing coating or impregnating textile fabrics, machines for reeling, unreeling, folding, cutting or pinking textile fabrics, and similar machinery for fabric processing"
C,28,282,2826,28264,subclass,"Manufacture of ironing machines, commercial washing and drying machines, dry-cleaning machines and other laundry machinery"
C,28,282,2826,28265,subclass,"Manufacture of sewing machines, sewing machine heads and sewing machine needles (whether or not for household use)"
C,28,282,2826,28266,subclass,"Manufacture of machinery for preparing, tanning or working hides, skins or leather, machinery for making or repairing footwear or other articles of hides, skins, leather or fur skins"
C,28,282,2826,28269,subclass,"Manufacture of other machinery for textiles, apparel and leather production n.e.c."
C,28,282,2829,,class,Manufacture of other special-purpose machinery
C,28,282,2829,28291,subclass,"Manufacture of machinery for making paper pulp, paper, paperboard and articles of paper board"
C,28,282,2829,28292,subclass,Manufacture of machinery for working soft rubber or plastics or for the
C,28,282,2829,28293,subclass,Manufacture of printing and bookbinding machines and machines for activities supporting printing on a variety of materials (other than textiles)
C,28,282,2829,28299,subclass,Manufacture of other special-purpose machinery n.e.c.
C,29,,,,division,"Manufacture of motor vehicles, trailers and semi-trailers"
C,29,291,,,group,Manufacture of motor vehicles
C,29,291,2910,,class,Manufacture of motor vehicles
C,29,291,2910,29101,subclass,Manufacture of passenger cars
C,29,291,2910,29102,subclass,"Manufacture of commercial vehicles such as vans, lorries, over-the-road tractors for semi-trailers etc."
C,29,291,2910,29103,subclass,Manufacture of chassis fitted with engines for the motor vehicles included in this class
C,29,291,2910,29104,subclass,Manufacture of motor vehicle engines
C,29,291,2910,29109,subclass,Manufacture of motor vehicles n.e.c.
C,29,292,,,group,Manufacture of bodies (coachwork) for motor vehicles; manufacture of
C,29,292,2920,,class,trailers and semi-trailers
C,29,292,2920,29201,subclass,"Manufacture of bodies, including cabs for motor vehicles"
C,29,292,2920,29202,subclass,Manufacture of trailers and semi-trailers for transport of goods or passengers
C,29,292,2920,29209,subclass,Manufacture of other attachments to motor vehicles n.e.c.
C,29,293,,,group,Manufacture of parts and accessories for motor vehicles
C,29,293,2930,,class,Manufacture of parts and accessories for motor vehicles
C,29,293,2930,29301,subclass,"Manufacture of diverse parts and accessories for motor vehecles sucs as brakes, gearboxes, axles, road wheels, suspension shock absorbers, radiators, silencers, exhaust pipes, catalysers, clutches, steering wheels, steering columns and steering boxes"
C,29,293,2930,29302,subclass,"Manufacture of parts and accessories of bodies for motor vehicles such as safety belts, airbags, doors, bumpers"
C,29,293,2930,29303,subclass,Manufacture of car seats
C,29,293,2930,29304,subclass,"Manufacture of motor vehicle electrical equipment, such as generators, alternators, spark plugs, ignition wiring harnesses, power window and door systems, assembly of purchased gauges into instrument panels, voltage regulators, etc."
C,30,,,,division,Manufacture of other transport equipment
C,30,301,,,group,Building of ships and boats
C,30,301,3011,,class,Building of ships and floating structures
C,30,301,3011,30111,subclass,"Building of commercial vessels: passenger vessels, ferry-boats, cargo ships, tankers, tugs, hovercraft (except recreation-type hovercraft) etc."
C,30,301,3011,30112,subclass,Building of warships and scientific investigation ships etc.
C,30,301,3011,30113,subclass,Building of fishing boats and fish-processing factory vessels
C,30,301,3011,30114,subclass,Construction of floating or submersible drilling platforms
C,30,301,3011,30115,subclass,"Construction of floating structures ( floating docks, pontoons, coffer-dams, floating landing stages, buoys, floating tanks, barges, lighters, floating cranes, non-recreational inflatable rafts etc.)"
C,30,301,3012,30120,subclass,Building of pleasure and sporting boats
C,30,302,,,group,Manufacture of railway locomotives and rolling stock
C,30,302,3020,,class,Manufacture of railway locomotives and rolling stock
C,30,302,3020,30201,subclass,"Manufacture of electric, diesel, steam and other rail locomotives"
C,30,302,3020,30202,subclass,"Manufacture of self-propelled railway or tramway coaches, vans and trucks, maintenance or service vehicles"
C,30,302,3020,30203,subclass,"Manufacture of railway or tramway rolling stock, not self-propelled (passenger coaches, goods vans tank wagons, self-discharging vans and wagons, workshop vans, crane vans, tenders etc.)"
C,30,302,3020,30204,subclass,"Manufacture of specialized parts of railway or tramway locomotives or of rolling stock (bogies, axles and wheels, brakes and parts of brakes; hooks and coupling devices, buffers and buffer parts; shock absorbers; wagon and locomotive frames; bodies;"
C,30,302,3020,30205,subclass,"Manufacture of mechanical and electro-mechanical signalling safety and traffic control equipment for railways, tramways, inland waterways, roads, parking facilities, airfields etc."
C,30,302,3020,30206,subclass,Manufacture of mining locomotives and mining rail cars
C,30,303,,,group,Manufacture of air and spacecraft and related machinery
C,30,303,3030,,class,Manufacture of air and spacecraft and related machinery
C,30,303,3030,30301,subclass,Manufacture of airplanes
C,30,303,3030,30302,subclass,Manufacture of helicopters
C,30,303,3030,30303,subclass,"Manufacture of gliders, hang-gliders, dirigibles and hot air balloons and other non-powered aircraft"
C,30,303,3030,30304,subclass,"Manufacture of spacecraft and launch vehicles, satellites, planetary probes, orbital stations, shuttles, intercontinental ballistic (ICBM) and similar missiles"
C,30,303,3030,30305,subclass,"Manufacture of parts and accessories of the aircraft and spacecraft of this class (major assemblies such as fuselages, wings, doors, control surfaces, landing gear, fuel tanks, nacelles, airscrews, helicopter rotors and propelled rotor blades, motors"
C,30,304,,,group,Manufacture of weapons and ammunition
C,30,304,3040,,class,Manufacture of weapons and ammunition
C,30,304,3040,30400,subclass,Manufacture of weapons and ammunition
C,30,309,,,group,Manufacture of transport equipment n.e.c.
C,30,309,3091,,class,Manufacture of motorcycles
C,30,309,3091,30911,subclass,"Manufacture of motorcycles, scooters, mopeds etc. and their engine"
C,30,309,3091,30912,subclass,Manufacture of three-wheelers and their engine
C,30,309,3091,30913,subclass,Manufacture of parts and accessories of three wheelers and motorcycles including side cars
C,30,309,3092,,class,Manufacture of bicycles and invalid carriages
C,30,309,3092,30921,subclass,"Manufacture of non-motorized bicycles and other cycles, including cycle-rickshaws, (delivery) tricycles, tandems, children’s bicycles and tricycles, baby carriages"
C,30,309,3092,30922,subclass,Manufacture of invalid carriages with or without motor
C,30,309,3092,30923,subclass,"Manufacture of parts and accessories for bicycles, cycle -rickshaws and invalid carriages"
C,30,309,3099,,class,Manufacture of other transport equipment n.e.c.
C,30,309,3099,30999,subclass,"Manufacture of other transport equipments n.e.c. such as pushcarts, handcarts etc"
C,31,,,,division,Manufacture of furniture
C,31,310,,,group,Manufacture of furniture
C,31,310,3100,,class,Manufacture of furniture
C,31,310,3100,31001,subclass,Manufacture of furniture made of wood
C,31,310,3100,31002,subclass,Manufacture of furniture made of cane & reed
C,31,310,3100,31003,subclass,Manufacture of furniture primarily of metal
C,31,310,3100,31004,subclass,Manufacture of furniture primarily of plastic
C,31,310,3100,31005,subclass,Manufacture of mattresses and pillows
C,31,310,3100,31009,subclass,Manufacture of other furniture n.e.c.
C,32,,,,division,Other manufacturing
C,32,321,,,group,"Manufacture of jewellery, bijouterie and related articles"
C,32,321,3211,,class,Manufacture of jewellery and related articles
C,32,321,3211,32111,subclass,"Manufacture of jewellery of gold, silver and other precious or base metal metal clad with precious metals or precious or semi-precious stones, or of combinations of precious metal and precious or semi-precious stones or of other materials"
C,32,321,3211,32112,subclass,Working of diamonds and other precious and semi-precious stones including the working of industrial quality stones and synthetic or reconstructed precious or semi-precious stones
C,32,321,3211,32113,subclass,Production of worked pearls
C,32,321,3211,32114,subclass,"Manufacture of coins, including coins for use as legal tender, whether or not of precious metal"
C,32,321,3211,32119,subclass,"Manufacture of other articles of gold, silver and other precious and semi precious metal and stone"
C,32,321,3212,,class,Manufacture of imitation jewellery and related articles
C,32,321,3212,32120,subclass,Manufacture of imitation jewellery and related articles
C,32,322,,,group,Manufacture of musical instruments
C,32,322,3220,,class,Manufacture of musical instruments
C,32,322,3220,32201,subclass,Manufacture of stringed instruments (non-electronic)
C,32,322,3220,32202,subclass,"Manufacture of wind instruments, accordions, harmoniumand similar instruments and mouth organs"
C,32,322,3220,32203,subclass,Manufacture of percussion musical instruments
C,32,322,3220,32204,subclass,"Manufacture of musical instruments, the sound of whichis produced electronically"
C,32,322,3220,32209,subclass,Manufacture of other musical instruments n.e.c.
C,32,323,,,group,Manufacture of sports goods
C,32,323,3230,32300,subclass,Manufacture of sports goods
C,32,324,,,group,Manufacture of games and toys
C,32,324,3240,,class,Manufacture of games and toys
C,32,324,3240,32401,subclass,Manufacture of dolls and toy animals
C,32,324,3240,32402,subclass,"Manufacture of wheeled toys designed to be ridden, including plastic bicycles and tricycles"
C,32,324,3240,32403,subclass,"Manufacture of pin-tables, coin-operated games, billiards, special tables for casino games, etc."
C,32,324,3240,32404,subclass,Manufacture of playing cards
C,32,324,3240,32405,subclass,Manufacture of electronic games
C,32,324,3240,32409,subclass,Manufacture of other games and toys n.e.c.
C,32,325,,,group,Manufacture of medical and dental instruments and supplies
C,32,325,3250,,class,Manufacture of medical and dental instruments and supplies
C,32,325,3250,32501,subclass,"Manufacture of dental fillings and cements (except denture adhesive or cement), dental wax and other dental plaster preparations; manufacture of dental laboratory furnaces, dental instruments, artificial teeth, bridges, etc., made in dental labs"
C,32,325,3250,32502,subclass,"Manufacture of laboratory apparatus (laboratory ultrasonic cleaning machinery, laboratory sterilizers, laboratory type distilling apparatus, laboratory centrifuges etc.)"
C,32,325,3250,32503,subclass,"Manufacture of medical, surgical, dental or veterinary furniture such as operating tables, examination tables, dentists’ chairs etc."
C,32,325,3250,32504,subclass,"Manufacture of bone plates and screws, syringes, needles, catheters, cannulae, etc."
C,32,325,3250,32505,subclass,Manufacture of measuring instruments suc as thermometers etc.
C,32,325,3250,32506,subclass,Manufacture of orthopedic and prosthetic devices
C,32,325,3250,32507,subclass,"Manufacture of ophthalmic goods, eyeglasses, sunglasses, lenses ground to prescription, contact lenses, safety goggles etc."
C,32,325,3250,32509,subclass,Manufacture of other medical and dental instruments n.e.c.
C,32,329,,,group,Other manufacturing n.e.c.
C,32,329,3290,,class,Other manufacturing n.e.c.
C,32,329,3290,32901,subclass,"Manufacture of stationary articles such as pens and pencils of all kinds whether or not mechanical, pencil leads, date, sealing or numbering stamps, hand-operated devices for printing or embossing labels, hand printing sets, prepared typewriter ribbo"
C,32,329,3290,32902,subclass,"Manufacture of protective safety equipment (fire-resistant and protective safety clothing, linemen’s safety belts and other belts for occupational use, cork life preservers, plastics hard hats and other personal safety equipment of plastics, fire-fig"
C,32,329,3290,32903,subclass,"Manufacture of umbrellas, sun-umbrellas, walking sticks, seat-stick"
C,32,329,3290,32904,subclass,"Manufacture of articles of personal use such as cigarette lighters, smoking pipes, combs, hair slides, scent sprays, vacuum flasks and other vacuum vessels for personal or household use, wigs, false beards, eyebrows etc."
C,32,329,3290,32909,subclass,Manufacture of other articles n.e.c.
C,33,,,,division,Repair and installation of machinery and equipment
C,33,331,,,group,"Repair of fabricated metal products, machinery and equipment"
C,33,331,3311,,class,Repair of fabricated metal products
C,33,331,3311,33111,subclass,Repair and maintenance of structural products
C,33,331,3311,33112,subclass,Repair and maintenance of pipes and pipelines
C,33,331,3311,33113,subclass,"Repair and maintenance of metal tanks, reservoirs, containers, steel shipping drums etc."
C,33,331,3311,33114,subclass,"Repair and maintenance of steam or other vapour generators and auxiliary plant for use with steam generators such as condensers, economizers, superheaters, steam collectors and accumulators"
C,33,331,3311,33119,subclass,Repair and maintenance of other fabricated metal products
C,33,331,3312,,class,Repair of machinery
C,33,331,3312,33121,subclass,"Repair and maintenance of engines and turbines excluding aircraft, vehicle and cycle engines"
C,33,331,3312,33122,subclass,"Repair and maintenance of pumps and related equipment, fluid power equipment, valves"
C,33,331,3312,33123,subclass,"Repair and maintenance of metal cutting and metal forming machine tools and accessories, power-driven hand-tools and other machine tools"
C,33,331,3312,33124,subclass,Repair and maintenance of agricultural machinery and forestry and logging machinery including agricultural tractors
C,33,331,3312,33125,subclass,"Repair and maintenance of mining, construction, and oil and gas field machinery; metallurgy machinery"
C,33,331,3312,33126,subclass,"Repair and maintenance of food, beverage, and tobacco processing machinery"
C,33,331,3312,33127,subclass,"Repair and maintenance of textile apparel, leather production machinery and papermaking machinery"
C,33,331,3313,,class,Repair of electronic and optical equipment
C,33,331,3313,33131,subclass,"Repair and maintenance of measuring, testing, navigating and control equipment of group 265"
C,33,331,3313,33132,subclass,"Repair and maintenance of irradiation, electromedical and electro theraputic equipmemts of class 2660"
C,33,331,3313,33133,subclass,Repair and maintenance of optical instruments and equipment of class 2670
C,33,331,3314,,class,Repair of electrical equipment
C,33,331,3314,33140,subclass,Repair of electrical equipment
C,33,331,3315,,class,"Repair of transport equipment, except motor vehicles"
C,33,331,3315,33150,subclass,"Repair of transport equipment, except motor vehicles"
C,33,331,3319,,class,Repair of other equipment
C,33,331,3319,33190,subclass,Repair of other equipment
C,33,332,,,group,Installation of industrial machinery and equipment
C,33,332,3320,,class,Installation of industrial machinery and equipment
C,33,332,3320,33200,subclass,Installation of industrial machinery and equipment
D,35,,,,division,"Electricity, Gas, Steam and Aircondition Supply"
D,35,351,,,group,"Electric power generation, transmission and distribution"
D,35,351,3510,,class,"Electric power generation, transmission and distribution"
D,35,351,3510,35101,subclass,Electric power generation by hydroelectric power plants
D,35,351,3510,35102,subclass,Electric power generation by coal based thermal power plants
D,35,351,3510,35103,subclass,"Electric power generation by non-coal based thermal (e.g. diesel, gas )"
D,35,351,3510,35104,subclass,Electric power generation and transmission by nuclear power plants
D,35,351,3510,35105,subclass,Electric power generation using solar energy
D,35,351,3510,35106,subclass,Electric power generation using other non conventional sources
D,35,351,3510,35107,subclass,Transmission of electric energy
D,35,351,3510,35109,subclass,"Collection and distribution of electric energy to households, industrial, commercial and other users n.e.c."
D,35,352,,,group,Manufacture of gas; distribution of gaseous fuels through mains
D,35,352,3520,,class,Manufacture of gas; distribution of gaseous fuels through mains
D,35,352,3520,35201,subclass,Manufacture of gas
D,35,352,3520,35202,subclass,Disrtibution and sale of gaseous fuels through mains
D,35,353,,,group,Steam and air conditioning supply
D,35,353,3530,,class,Steam and air conditioning supply
D,35,353,3530,35301,subclass,"Production, collection and distribution of steam and hot water for heating, power and other purposes"
D,35,353,3530,35302,subclass,Production and distribution of cooled air and chilled water for cooling purposes
D,35,353,3530,35303,subclass,"Production of ice, including ice for food and non-food (e.g. cooling) purposes"
E,,,,,section,"WATER SUPPLY; SEWERAGE, WASTE MANAGEMENT and"
E,36,,,,division,"Water collection , treatment and supply"
E,36,360,,,group,"Water collection, treatment and supply"
E,36,360,3600,,class,"Water collection, treatment and supply"
E,36,360,3600,36000,subclass,"Water collection, treatment and supply"
E,37,,,,division,Sewerage
E,37,370,,,group,Sewerage
E,37,370,3700,,class,Sewerage
E,37,370,3700,37001,subclass,The operation and maintenance of sewer systems
E,37,370,3700,37002,subclass,"Collecting and transporting of human or industrial waste water or rain water by means of sewerage networks, collectors, tanks and other means of transport (sewage vehicles etc.)"
E,37,370,3700,37003,subclass,"Treatment of waste water or sewer by means of physical, chemical or biological processes"
E,38,,,,division,"Waste collection, treatment and disposal activities materials recovery"
E,38,381,,,group,Waste collection
E,38,381,3811,,class,Collection of non-hazardous waste
E,38,381,3811,38110,subclass,Collection of non-hazardous waste
E,38,381,3812,38120,subclass,Collection of hazardous waste
E,38,382,,,group,Waste treatment and disposal
E,38,382,3821,,class,Treatment and disposal of non-hazardous waste
E,38,382,3821,38210,subclass,Treatment and disposal of non-hazardous waste
E,38,382,3822,,class,Treatment and disposal of hazardous waste
E,38,382,3822,38221,subclass,"Treatment and disposal of toxic live or dead animals and other, contaminated waste, disposal of used goods; incineration of hazardous waste"
E,38,382,3822,38222,subclass,"Treatment, disposal and storage of radioactive nuclear waste"
E,38,383,,,group,Materials recovery
E,38,383,3830,,class,Materials recovery
E,38,383,3830,38300,subclass,Materials recovery
E,39,,,,division,Remediation activities and other waste management services
E,39,390,,,group,Remediation activities and other waste management services
E,39,390,3900,,class,Remediation activities and other waste management services
E,39,390,3900,39000,subclass,Remediation activities and other waste management services
F,41,,,,division,Construction of buildings
F,41,410,,,group,Construction of buildings
F,41,410,4100,,class,Construction of buildings
F,41,410,4100,41001,subclass,Construction of buildings carried out on own-account basis or on a fee or contract basis
F,41,410,4100,41002,subclass,"Activities relating to alteration, addition, repair, maintenance carried out on own-account basis or on a fee or contract basis"
F,41,410,4100,41003,subclass,Assembly and erection of prefabricated constructions on the site
F,42,,,,division,Civil engineering
F,42,421,,,group,Construction roads and railways
F,42,421,4210,,class,Construction roads and railways
F,42,421,4210,42101,subclass,"Construction and maintenance of motorways, streets, roads, other vehicular and pedestrian ways, highways, bridges, tunnels and subways"
F,42,421,4210,42102,subclass,Construction and maintenance of railways and rail-bridges
F,42,421,4210,42103,subclass,Construction and maintenance of airfield runways
F,42,422,,,group,Construction of utility projects
F,42,422,4220,,class,Construction of utility projects
F,42,422,4220,42201,subclass,Construction and maintenance of power plants
F,42,422,4220,42202,subclass,"Construction/erection and maintenance of power, telecommunication and transmission lines"
F,42,422,4220,42203,subclass,Construction of long distance pipelines or urban pipelines
F,42,422,4220,42204,subclass,"Construction and maintenance of water main and line connection, water reservoirs including irrigation system (canal)"
F,42,422,4220,42205,subclass,Construction and repair of sewer systems including sewage disposal plants and pumping stations
