section,division,group,class,subclass,text_of,text
C,21,210,2100,,class,"Manufacture of pharmaceuticals, medicinal chemical and botanical products"
C,21,210,2100,21001,subclass,"Manufacture of medicinal substances used in the manufacture of pharmaceuticals: antibiotics, endocrine products, basic vitamins; opium derivatives; sulpha drugs; serums and plasmas; salicylic acid, its salts and esters; glycosides and vegetable alkal"
C,21,210,2100,21002,subclass,Manufacture of allopathic pharmaceutical preparations
C,21,210,2100,21003,subclass,Manufacture of `ayurvedic’ or `unani’ pharmaceutical preparation
C,21,210,2100,21004,subclass,Manufacture of homoeopathic or biochemic pharmaceutical preparations
C,21,210,2100,21005,subclass,Manufacture of veterinary preparations
C,21,210,2100,21006,subclass,"Manufacture of medical impregnated wadding, gauze, bandages, dressings, surgical gut string etc."
C,21,210,2100,21009,subclass,Manufacture of other pharmaceutical and botanical products n.e.c. like hina powder etc.
C,22,,,,division,Manufacture of rubber and plastics products
C,22,221,,,group,Manufacture of rubber products
C,22,221,2211,,class,Manufacture of rubber tyres and tubes; retreading and rebuilding of rubber tyres
C,22,221,2211,22111,subclass,"Manufacture of rubber tyres and tubes for motor vehicles, motorcycles, scooters, three-wheelers, tractors and aircraft"
C,22,221,2211,22112,subclass,Manufacture of rubber tyres and tubes for cycles and cycle-rickshaws
C,22,221,2211,22113,subclass,Retreading of tyres; replacing or rebuilding of tread on used pneumatic tyres
C,22,221,2211,22119,subclass,Manufacture of rubber tyres and tubes n.e.c.
C,22,221,2219,,class,Manufacture of other rubber products
C,22,221,2219,22191,subclass,"Manufacture of rubber plates, sheets, strips, rods, tubes, pipes, hoses and profile -shapes etc."
C,22,221,2219,22192,subclass,Manufacture of rubber conveyor or transmission belts or belting
C,22,221,2219,22193,subclass,Manufacture of rubber contraceptives
C,22,221,2219,22194,subclass,Manufacture of rubber balloons
C,22,221,2219,22199,subclass,Manufacture of other rubber products n.e.c.
C,22,222,,,group,Manufacture of plastics products
C,22,222,2220,,class,Manufacture of plastics products
C,22,222,2220,22201,subclass,"Manufacture of semi-finished of plastic products (plastic plates, sheets, blocks, film, foil, strip etc.)"
C,22,222,2220,22202,subclass,"Manufacture of tableware, kitchenware and other household articles and toilet articles of plastic, including manufacture of vacuum flasks and other vacuum vessels"
C,22,222,2220,22203,subclass,"Manufacture of plastic articles for the packing of goods (plastic bags, sacks, containers, boxes, cases, carboys, bottles etc.)"
C,22,222,2220,22204,subclass,"Manufacture of bathing tubs, wash-basins, lavatory pans and covers, flushing cisterns and similar sanitary-ware of plastics"
C,22,222,2220,22205,subclass,"Manufacture of travel goods of plastics (suitcase, vanity bags, holdalls and similar articles)"
C,22,222,2220,22206,subclass,Manufacture of spectacle frames of plastic
C,22,222,2220,22207,subclass,Manufacture of moulded industrial accessories of plastics
C,22,222,2220,22208,subclass,Manufacture of polymer/ synthetic / PVC water storage tanks
C,22,222,2220,22209,subclass,Manufacture of other plastics products n.e.c.
C,23,,,,division,Manufacture of other non-metallic mineral products
C,23,231,,,group,Manufacture of glass and glass products
C,23,231,2310,,class,Manufacture of glass and glass products
C,23,231,2310,23101,subclass,"Manufacture of glass in primary or semi-manufactured forms (such as sheets & plate glass) including mirror sheets and wired, coloured, tinted, toughened or laminated glass"
C,23,231,2310,23102,subclass,"Manufacture of glass fibre (including glass-wool) and yarn of glass fibre nonwoven glass fabrics, mats, boards and similar non-woven products"
C,23,231,2310,23103,subclass,"Manufacture of hollow glassware (bottles, jars etc.) for the conveyance or packing of goods"
C,23,231,2310,23104,subclass,Manufacture of laboratory or pharmaceutical glassware
C,23,231,2310,23105,subclass,Manufacture of table or kitchen glassware
C,23,231,2310,23106,subclass,Manufacture of glass bangles
C,23,231,2310,23107,subclass,Manufacture of glass decoration pieces and glassware used in imitation jewellery
C,23,231,2310,23109,subclass,"Manufacture of other glassware/glass products: articles of glass used in construction such as glass blocks; clock or watch glasses, optical glass and optical glass elements not optically worked; and other glass products (including glass beads) n.e.c."
C,23,239,,,group,Manufacture of non-metallic mineral products n.e.c.
C,23,239,2391,,class,Manufacture of refractory products
C,23,239,2391,23911,subclass,"Manufacture of refractory mortars, concretes etc."
C,23,239,2391,23912,subclass,"Manufacture of refractory bricks, blocks tiles and similar refractory ceramic constructional goods"
C,23,239,2391,23913,subclass,Manufacture of refractory ceramic products
C,23,239,2391,23919,subclass,Manufacture of other refractory articles n.e.c.
C,23,239,2392,,class,Manufacture of clay building materials
C,23,239,2392,23921,subclass,Manufacture of bricks
C,23,239,2392,23922,subclass,"Manufacture of non-refractory ceramic sanitary wares: sinks, baths, water-closet pans, flushing cistern etc."
C,23,239,2392,23923,subclass,"Manufacture of non-refractory ceramic pipes, conduits, guttering and pipe fittings"
C,23,239,2392,23929,subclass,Manufacture of other clay building materials
C,23,239,2393,,class,Manufacture of other porcelain and ceramic products
C,23,239,2393,23931,subclass,"Manufacture of articles of porcelain or china, earthenware, imitation porcelain or common pottery, including earthen statues"
C,23,239,2393,23932,subclass,Manufacture of ceramic tableware and other domestic or toilet articles
C,23,239,2393,23933,subclass,Manufacture of statuettes and other ornamental ceramic articles
C,23,239,2393,23934,subclass,Manufacture of electrical insulators and insulating fittings of ceramics
C,23,239,2393,23935,subclass,"Manufacture of ceramic laboratory, chemical and industrial products"
C,23,239,2393,23939,subclass,Manufacture of ceramic products n.e.c.
C,23,239,2394,,class,"Manufacture of cement, lime and plaster"
C,23,239,2394,23941,subclass,Manufacture of clinkers and cement
C,23,239,2394,23942,subclass,"Manufacture of portland cement, aluminous cement, slag cement and similar hydraulic cement"
C,23,239,2394,23943,subclass,Manufacture of asbestos cement
C,23,239,2394,23944,subclass,"Manufacture of quicklime, slaked lime and hydraulic lime (excluding chewing lime)"
C,23,239,2394,23945,subclass,Manufacture of plasters of calcined gypsum or calcined sulphate
C,23,239,2394,23949,subclass,Manufacture of other cement and plaster n.e.c.
C,23,239,2395,,class,"Manufacture of articles of concrete, cement and plaster"
C,23,239,2395,23951,subclass,Manufacture of plaster statues and other plaster products
C,23,239,2395,23952,subclass,"Manufacture of articles articles of concrete, cement or artificial stone (tiles, bricks etc.)"
C,23,239,2395,23953,subclass,Manufacture of asbestos sheets
C,23,239,2395,23954,subclass,Manufacture of R.C.C. bricks and blocks
C,23,239,2395,23955,subclass,Manufacture of hume pipes and other pre-fabricated structural components of cement and/or concrete for building or civil engineering
C,23,239,2395,23956,subclass,"Manufacture of insulation boards of vegetable fibre, straw or wood waste, agglomerated with cement & other mineral binders."
C,23,239,2395,23959,subclass,Manufacture of other cement and asbestos cement products n.e.c.
C,23,239,2396,,class,"Cutting, shaping and finishing of stone"
C,23,239,2396,23960,subclass,"Cutting, shaping and finishing of stone"
C,23,239,2399,,class,Manufacture of other non-metallic mineral products n.e.c.
C,23,239,2399,23991,subclass,Manufacture of worked mica and mica products
C,23,239,2399,23992,subclass,Manufacture of gypsum boards
C,23,239,2399,23993,subclass,"Manufacture of millstones, sharpening or polishing stones and natural or artificial abrasive products, including abrasive powder or grain on a base of textile material, paper, paper board or other material"
C,23,239,2399,23994,subclass,Manufacture of graphite products other than electrical articles
C,23,239,2399,23999,subclass,Manufacture of other non-metallic mineral products n.e.c.
C,24,,,,division,Manufacture of Basic Metals
C,24,241,,,group,Manufacture of basic iron and steel
C,24,241,2410,,class,Manufacture of basic iron and steel
C,24,241,2410,24101,subclass,"Manufacture of pig iron and spiegeleisen in pigs, blocks or other primary forms"
C,24,241,2410,24102,subclass,Manufacture of direct reduction of iron (sponge iron) and other spongy ferrous products
C,24,241,2410,24103,subclass,"Manufacture of steel in ingots or other primary forms, and other semi-finished products of steel"
C,24,241,2410,24104,subclass,Manufacture of ferro-alloys
C,24,241,2410,24105,subclass,Manufacture of hot-rolled and cold-rolled products of steel
C,24,241,2410,24106,subclass,Manufacture of tube and tube fittings of basic iron and steel
C,24,241,2410,24107,subclass,Manufacture of railway track materials (unassembled rails) of steel
C,24,241,2410,24108,subclass,Manufacture of wire of steel by cold drawing or stretching
C,24,241,2410,24109,subclass,Manufacture of other basic iron and steel n.e.c
C,24,242,,,group,Manufacture of basic precious and other non-ferrous metals
C,24,242,2420,,class,Manufacture of basic precious and other non-ferrous metals
C,24,242,2420,24201,subclass,"Manufacture of Copper from ore, and other copper products and alloys"
C,24,242,2420,24202,subclass,Manufacture of Aluminium from alumina and by other methods and products of aluminium and alloys
C,24,242,2420,24203,subclass,"Manufacturing of lead, zinc and tin products and alloys"
C,24,242,2420,24204,subclass,"Manufacturing of chrome, manganese and nickel products alloys"
C,24,242,2420,24205,subclass,"Production and refining of precious metals (such as gold, silver platinum etc.) and alloys"
C,24,242,2420,24209,subclass,Manufacture of other non-ferrous metals n.e.c.
C,24,243,,,group,Casting of metals
C,24,243,2431,,class,Casting of iron and steel
C,24,243,2431,24311,subclass,"Manufacture of tubes, pipes and hollow profiles and of tube or pipe fittings of cast-iron/cast-steel"
C,24,243,2431,24319,subclass,Manufacture of other iron and steel casting and products thereof
C,24,243,2432,,class,Casting of non-ferrous metals
C,24,243,2432,24320,subclass,Casting of non-ferrous metals
C,25,,,,division,Manufacture of fabricated metal
C,25,251,,,group,"Manufacture of structural metal products, tanks, reservoirs and steam generators"
C,25,251,2511,,class,Manufacture of structural metal products
C,25,251,2511,25111,subclass,"Manufacture of doors, windows and their frames, shutters and rolling shutters, gates and similer articles used on buildings"
C,25,251,2511,25112,subclass,"Manufacture of metal frameworks or skeletons for construction and parts thereof (towers, masts, trusses, bridges etc.)"
C,25,251,2511,25113,subclass,"Manufacture of industrial frameworks in metal (frameworks for blast furnaces, lifting and handling equipment etc.)"
C,25,251,2511,25119,subclass,Manufacture of other structural metal products
C,25,251,2512,,class,"Manufacture of tanks, reservoirs and containers of metal"
C,25,251,2512,25121,subclass,Manufacture of metal containers for compressed or liquefied gas
C,25,251,2512,25122,subclass,"Manufacture of metal reservoirs, tanks and similar containers"
C,25,251,2512,25123,subclass,Manufacture of central heating boilers and radiators and parts and accessories thereof
C,25,251,2512,25129,subclass,Manufacture of other containers n.e.c.
C,25,251,2513,,class,"Manufacture of steam generators, except central heating hot water boilers"
C,25,251,2513,25131,subclass,Manufacture of steam or other vapour generating boilers and hot water boilers other than central heating boilers
C,25,251,2513,25132,subclass,"Manufacture of nuclear reactors, except isotope separators"
C,25,251,2513,25133,subclass,"Manufacture of auxiliary plant for use with steam generators (condensers, economizers, superheaters, steam collectors and accumulators)"
C,25,251,2513,25139,subclass,"Manufacture of other steam generators (except central heating hot water boilers), n.e.c."
C,25,252,,,group,Manufacture of weapons and ammunition
C,25,252,2520,,class,Manufacture of weapons and ammunition
C,25,252,2520,25200,subclass,Manufacture of weapons and ammunition
C,25,259,,,group,Manufacture of other fabricated metal products; metalworking service activities
C,25,259,2591,,class,"Forging,  pressing,  stamping  and  roll-forming  of  metal;  powder metallurgy"
C,25,259,2591,25910,subclass,"Forging, pressing, stamping and roll-forming of metal; powder metallurgy"
C,25,259,2592,,class,Machining; treatment and coating of metals
C,25,259,2592,25920,subclass,Machining; treatment and coating of metals
C,25,259,2593,,class,"Manufacture of cutlery, hand tools and general hardware"
C,25,259,2593,25931,subclass,"Manufacture of cutlery such as knives, forks, spoons, cleavers, choppers, razors, razor blades, scissors, hair clippers etc."
C,25,259,2593,25932,subclass,Manufacture of hand tools (non-power-driven) for agricultural/horticulture/forestry
C,25,259,2593,25933,subclass,"Manufacture of hand tools such as pliers, screwdrivers, press tools, blacksmiths’ tools, drills, punches, milling cutters etc."
C,25,259,2593,25934,subclass,"Manufacture of padlocks, locks, keys, hinges and the like, hardware for buildings, furniture, vehicles etc."
C,25,259,2593,25939,subclass,"Manufacture of general hardware (saws and sawblades, including circular"
C,25,259,2599,,class,Manufacture of other fabricated metal products n.e.c.
C,25,259,2599,25991,subclass,"Manufacture of metal fasteners (nails, rivets, tacks, pins, staples, washers and similar non-threaded products and nuts, bolts, screws and other threaded products)"
C,25,259,2599,25992,subclass,Manufacture of containers such as tins and cans for food products and boxes
C,25,259,2599,25993,subclass,Manufacture of metal cable and other articles made of wire (except for electric transmission)
C,25,259,2599,25994,subclass,"Manufacture of metal household articles (plates, saucers, pots, kettles, saucepans, frying pans and other non-electrical utensils, small hand-operated kitchen appliances and accessories)"
C,25,259,2599,25995,subclass,"Manufacture of metal sanitaryware such as baths, sinks, washbasins and similar articles"
C,25,259,2599,25996,subclass,"Manufacture of reinforced safes, vaults, strongroom doors, gates and metal goods for office use (other than office furniture) and other purposes"
C,25,259,2599,25999,subclass,Manufacture of other fabricated metal products n.e.c.
C,26,,,,division,"Manufacture of computer, electronic and optical products."
C,26,261,,,group,Manufacture of electronic components
C,26,261,2610,,class,Manufacture of electronic components
C,26,261,2610,26101,subclass,"Manufacture of electronic capacitors, resistors, chokes, coils, trasformers (electronic) and similar components"
C,26,261,2610,26102,subclass,"Manufacture of electron tubes, diodes, transistors and related discrete devices"
C,26,261,2610,26103,subclass,"Manufacture of integrated circuits (analog, digital or hybrid)"
C,26,261,2610,26104,subclass,"Manufacture of bare printed circuit boards, loading of components onto printed circuit boards; manufacture of interface cards (e.g. sound, video, controllers, network, modems)"
C,26,261,2610,26105,subclass,"Manufacture of display components (plasma, polymer, LCD, LED)"
C,26,261,2610,26106,subclass,"Manufacture of printer cables, monitor cables, USB cables, connectors etc."
C,26,261,2610,26107,subclass,Manufacture of microprocessors
C,26,261,2610,26109,subclass,Manufacture of other electronic components n.e.c
C,26,262,,,group,Manufacture of computers and peripheral equipment
C,26,262,2620,,class,Manufacture of computers and peripheral equipment
C,26,262,2620,26201,subclass,"Manufacture of desktop computers, laptop computers, hand-held computers (e.g. PDA), mainframe computers and computer servers"
C,26,262,2620,26202,subclass,"Manufacture of magnetic and optical storage devices such as magnetic disk drives, flash drives, CD, DVD and other storage devices"
C,26,262,2620,26203,subclass,"Manufacture of monitors, keyboards, all types of mice, joysticks, and trackball accessories, dedicated computer terminals etc."
C,26,262,2620,26204,subclass,"Manufacture of printers, scanners, including bar code scanners, smart card readers, virtual reality helmets, computer projectors (video beamers)"
C,26,262,2620,26205,subclass,"Manufacture of computer terminals, like automatic teller machines (ATM’s), point-of-sale (POS) terminals not mechanically operated"
C,26,262,2620,26209,subclass,Manufacture of computers and peripheral equipment n.e.c.
C,26,263,,,group,Manufacture of communication equipment
C,26,263,2630,,class,Manufacture of communication equipment
C,26,263,2630,26301,subclass,"Manufacture of radio and television studio and broadcasting equipment, including television cameras"
C,26,263,2630,26302,subclass,"Manufacture of telephone and facsimile equipment, including telephone answering machines, PBX"
C,26,263,2630,26303,subclass,"Manufacture of data communications equipment, such as bridges, routers, and gateways"
C,26,263,2630,26304,subclass,"Manufacture of cable television equipment, transmitting and receiving antenna including dish, VSAT"
C,26,263,2630,26305,subclass,"Manufacture of pagers, cellular phones and other mobile communication equipment"
C,26,263,2630,26309,subclass,Manufacture of other communication equipments n.e.c.
C,26,264,,,group,Manufacture of consumer electronics
C,26,264,2640,,class,Manufacture of consumer electronics
C,26,264,2640,26401,subclass,"Manufacture of televisions, television monitors and displays"
C,26,264,2640,26402,subclass,Manufacture video cassette recorders and duplicating equipment
C,26,264,2640,26403,subclass,Manufacture of audio recording and duplicating systems
C,26,264,2640,26404,subclass,Manufacture of radio receivers
C,26,264,2640,26405,subclass,"Manufacture of stereo equipment, speaker systems, amplifiers for musical instruments and public address systems, microphones, karaoke machines, headphones (e.g. radio, stereo, computer)"
C,26,264,2640,26406,subclass,Manufacture of CD and DVD players
C,26,264,2640,26409,subclass,Manufacture of other electronic consumer goods n.e.c. (this includes non-television video camera)
C,26,265,,,group,"Manufacture of measuring, testing, navigating and control equipment watches and clocks"
C,26,265,2651,,class,"Manufacture of measuring, testing, navigating and control equipment"
C,26,265,2651,26511,subclass,Manufacture of physical properties testing and inspection equipment
C,26,265,2651,26512,subclass,Manufacture of automotive emissions testing equipment
C,26,265,2651,26513,subclass,"Manufacture of consumption meters for electricity, water or gas, flow meters and counting meters"
C,26,265,2651,26514,subclass,Manufacture of meteorological instruments
C,26,265,2651,26515,subclass,"Manufacture of radar equipment, GPS devices, search, detection, navigation, aeronautical and nautical equipment"
C,26,265,2651,26516,subclass,"Manufacture of laboratory analytical instruments and miscellaneous laboratory apparatus for measuring and testing such as scales, balances, incubators etc."
C,26,265,2651,26517,subclass,Manufacture of industrial process control equipment
C,26,265,2651,26519,subclass,Manufacture of other measuring n.e.c.
C,26,265,2652,,class,Manufacture of watches and clocks
C,26,265,2652,26521,subclass,"Manufacture of watches and clocks, including instrument panel clocks (except time-recording equipment)"
C,26,265,2652,26522,subclass,"Manufacture of components for clocks and watches (springs, jewels, dials, hands, plates, bridges and other parts), watch and clock cases, including cases of precious metals"
C,26,265,2652,26523,subclass,"Manufacture of time-recording equipments such as time-clock, parking meters etc."
C,26,265,2652,26529,subclass,Manufacture of other watches and clocks n.e.c.
C,26,266,,,group,"Manufacture of irradiation, electromedical and electrotherapeutic equipment"
C,26,266,2660,,class,"Manufacture of irradiation, electromedical and electrotherapeutic equipment"
C,26,266,2660,26600,subclass,"Manufacture  of  irradiation,  electromedical  and  electrotherapeutic equipment"
C,26,267,,,group,Manufacture of optical instruments and equipment
C,26,267,2670,,class,Manufacture of optical instruments and equipment
C,26,267,2670,26700,subclass,Manufacture of optical instruments and equipment
C,26,268,,,group,Manufacture of magnetic and optical media
C,26,268,2680,,class,Manufacture of magnetic and optical media
C,26,268,2680,26800,subclass,Manufacture of magnetic and optical media
C,27,,,,division,Manufacture of electrical equipment
C,27,271,,,group,"Manufacture of electric motors, generators, transformers and electricity distribution and control apparatus"
C,27,271,2710,,class,"Manufacture of electric motors, generators, transformers and electricity distribution and control apparatus"
C,27,271,2710,27101,subclass,"Manufacture of power generators (except battery charging alternators for internal combustion engines), motor generator sets (except turbine generator set units)"
C,27,271,2710,27102,subclass,"Manufacture of electric power distribution transformers, arc-welding transformers, fluorescent ballasts, transmission and distribution voltage regulators"
C,27,271,2710,27103,subclass,Manufacture of electric motors (except internal combustion engine starting motors)
C,27,271,2710,27104,subclass,Manufacture of electricity distribution and control apparatus
C,27,272,,,group,Manufacture of batteries and accumulators
C,27,272,2720,,class,Manufacture of batteries and accumulators
C,27,272,2720,27201,subclass,"Manufacture of primary cells and primary batteries nd rechargable batteries, cells containing manganese oxide, mercuric oxide silver oxide or other material"
C,27,272,2720,27202,subclass,"Manufacture of electric accumulator incuding parts thereof (separators, containers, covers)"
C,27,273,,,group,Manufacture of wiring and wiring devices
C,27,273,2731,,class,Manufacture of fibre optic cables for data transmission or live transmission of images
C,27,273,2731,27310,subclass,Manufacture of fibre optic cables for data transmission or live transmission of images
C,27,273,2732,,class,Manufacture of other electronic and electric wires and cables
C,27,273,2732,27320,subclass,"Manufacture of other electronic and electric wires and cables (insulated wire and cable made of steel, copper, aluminium)"
C,27,273,2733,,class,Manufacture of wiring devices
C,27,273,2733,27331,subclass,"Manufacture of switch, switch box, lamp holders, lugs etc."
C,27,273,2733,27339,subclass,Manufacture of other wiring devices and fittings n.e.c.
C,27,274,,,group,Manufacture of electric lighting equipment
C,27,274,2740,,class,Manufacture of electric lighting equipment
C,27,274,2740,27400,subclass,Manufacture of electric lighting equipment
C,27,275,,,group,Manufacture of domestic appliances
C,27,275,2750,,class,Manufacture of domestic appliances
C,27,275,2750,27501,subclass,"Manufacture of domestic electric appliances such as refrigerators, washing machines, vacuum cleaners, mixers, grinders etc."
C,27,275,2750,27502,subclass,"Manufacture of domestic electrothermic appliances such as electric water heaters, space heaters, irons, ovens, toasters, microwave ovens etc"
C,27,275,2750,27503,subclass,Manufacture of electric fans (except exhaust fans)
C,27,275,2750,27504,subclass,"Manufacture of domestic non-electric cooking and heating equipment such as non-electric space heaters, cooking ranges, grates, stoves, water heaters, cooking appliances, plate warmers"
C,27,275,2750,27509,subclass,Manufacture of other domestic appliances n.e.c.
C,27,279,,,group,Manufacture of other electrical equipment
C,27,279,2790,,class,Manufacture of other electrical equipment
C,27,279,2790,27900,subclass,Manufacture of other electrical equipment
C,28,,,,division,Manufacture of machinery and equipment n.e.c.
C,28,281,,,group,Manufacture of general purpose machinery
C,28,281,2811,,class,"Manufacture of engines and turbines, except aircraft, vehicle and cycle engines"
C,28,281,2811,28110,subclass,"Manufacture of engines and turbines, except aircraft, vehicle and cycle engines"
C,28,281,2812,,class,Manufacture of fluid power equipment
C,28,281,2812,28120,subclass,Manufacture of fluid power equipment
C,28,281,2813,,class,"Manufacture of other pumps, compressors, taps and valves"
C,28,281,2813,28131,subclass,Manufacture of hand pumps
C,28,281,2813,28132,subclass,"Manufacture of other pumps, compressors, taps and valves etc."
C,28,281,2814,,class,"Manufacture of bearings, gears, gearing and driving elements"
C,28,281,2814,28140,subclass,"Manufacture of bearings, gears, gearing and driving elements"
C,28,281,2815,,class,"Manufacture of ovens, furnaces and furnace burners"
C,28,281,2815,28150,subclass,"Manufacture of ovens, furnaces and furnace burners"
C,28,281,2816,,class,Manufacture of lifting and handling equipment
C,28,281,2816,28161,subclass,"Manufacture of lifts, escalators and moving walkways"
C,28,281,2816,28162,subclass,Manufacture of other lifting and handling equipment and parts thereof
C,28,281,2817,,class,Manufacture of office machinery and equipment
C,28,281,2817,28170,subclass,Manufacture of office machinery and equipment
