section,division,group,class,subclass,text_of,text
A,,,,,section,"AGRICULTURE, FORESTY AND FISHING"
A,01,,,,division,"Crop and animal production, hunting and related service activities"
A,01,011,,,group,Growing of non-perennial crops
A,01,011,0111,,class,"Growing of cereals (except rice), leguminous crops and oil seeds"
A,01,011,0111,01111,subclass,Growing of wheat
A,01,011,0111,01112,subclass,"Growing of jowar, bajra and millets"
A,01,011,0111,01113,subclass,Growing of other cereals
A,01,011,0111,01114,subclass,"Growing of pulses (dal) and other leguminous crops such as peas and beans, not used as oilseeds"
A,01,011,0111,01115,subclass,Growing of mustard oil seed
A,01,011,0111,01116,subclass,Growing of groundnut oil seed
A,01,011,0111,01117,subclass,Growing of sunflower oil seed
A,01,011,0111,01118,subclass,Growing of soya bean oil seed
A,01,011,0111,01119,subclass,Growing of other oil seeds
A,01,011,0112,,class,Growing of rice
A,01,011,0112,01121,subclass,Organic farming of basmati rice
A,01,011,0112,01122,subclass,Organic farming of non-basmati rice
A,01,011,0112,01123,subclass,Inorganic farming of basmati rice
A,01,011,0112,01124,subclass,Inorganic farming of non-basmati rice
A,01,011,0113,,class,"Growing of vegetables and melons, roots and tubers"
A,01,011,0113,01131,subclass,"Growing of asparagus, cabbages, cauliflower, broccoli, lettuce, chicory, spinach and other leafy or stem vegetables"
A,01,011,0113,01132,subclass,"Growing of cucumbers, gherkins, aubergines, tomatoes, watermelons, cantaloupes , melons and other fruit-bearing vegetables"
A,01,011,0113,01133,subclass,Growing of onion
A,01,011,0113,01134,subclass,"Growing of carrots, beets,turnips, garlic, leeks and other root, bulb vegetables(onion excluded)"
A,01,011,0113,01135,subclass,"Growing of potatoes and other tubers such as sweet potatoes, cassava, yams"
A,01,011,0113,01136,subclass,Growing of mushrooms and truffles
A,01,011,0113,01137,subclass,Growing of vegetable seeds (except beet seed)
A,01,011,0113,01139,subclass,"Growing of vegetables, n.e.c."
A,01,011,0114,,class,Growing of sugar cane
A,01,011,0114,01140,subclass,Growing of sugar cane
A,01,011,0115,,class,Growing of tobacco
A,01,011,0115,01150,subclass,Growing of tobacco
A,01,011,0116,,class,Growing of fibre crops
A,01,011,0116,01161,subclass,Growing of cotton
A,01,011,0116,01162,subclass,Growing of jute
A,01,011,0116,01169,subclass,Growing of other fibre crops
A,01,011,0119,,class,Growing of other non-perennial crop
A,01,011,0119,01191,subclass,Growing of rose
A,01,011,0119,01192,subclass,Growing of gladiolus
A,01,011,0119,01193,subclass,"Growing of other flowers, including production of cut flowers, flower buds and flower seeds"
A,01,011,0119,01199,subclass,"Growing of other non-perennial crops including beet seed and padding materials, n.e.c."
A,01,012,,,group,Growing of perennial crops
A,01,012,0121,,class,Growing of grapes
A,01,012,0121,01210,subclass,Growing of grapes
A,01,012,0122,,class,Growing of tropical and subtropical fruits
A,01,012,0122,01221,subclass,Growing of mangoes
A,01,012,0122,01222,subclass,Growing of bananas
A,01,012,0122,01223,subclass,Growing of pineapples
A,01,012,0122,01224,subclass,Growing of lichchis
A,01,012,0122,01225,subclass,Growing of guava
A,01,012,0122,01229,subclass,Growing of other tropical and sub tropical fruits
A,01,012,0123,,class,Growing of citrus fruits
A,01,012,0123,01231,subclass,Growing of oranges
A,01,012,0123,01232,subclass,Growing of mousambi (grape fruit)
A,01,012,0123,01233,subclass,Growing of lemons and lime
A,01,012,0123,01239,subclass,Growing of other citrus fruits
A,01,012,0124,,class,Growing of pome fruits and stone fruits
A,01,012,0124,01241,subclass,Growing of apples
A,01,012,0124,01242,subclass,"Growing of appricots, peaches and nectarines"
A,01,012,0124,01243,subclass,Growing of cherries and sour cherries
A,01,012,0124,01249,subclass,Growing of other pome fruits and stone fruits
A,01,012,0125,,class,Growing of other tree and bush fruits and nuts
A,01,012,0125,01251,subclass,Growing of strawberries and other berries
A,01,012,0125,01252,subclass,"Growing of edible nuts (almonds, cashew nuts, chestnuts, hazelnuts pistachios, walnuts and other nuts)"
A,01,012,0125,01259,subclass,"Growing of other tree and bush fruits, n.e.c."
A,01,012,0126,,class,Growing of oleaginous fruits
A,01,012,0126,01261,subclass,Growing of coconut
A,01,012,0126,01262,subclass,Growing of olives and oil palms
A,01,012,0126,01269,subclass,Growing of other oleaginous fruits
A,01,012,0127,,class,Growing of beverage crops
A,01,012,0127,01271,subclass,Growing of tea
A,01,012,0127,01272,subclass,Growing of coffee
A,01,012,0127,01273,subclass,Growing of cocoa
A,01,012,0127,01279,subclass,Growing of other beverage crops
A,01,012,0128,,class,"Growing of spices, aromatic, drug and pharmaceutical crops"
A,01,012,0128,01281,subclass,Growing of ginger
A,01,012,0128,01282,subclass,Growing of chili
A,01,012,0128,01283,subclass,Growing of cardamoms
A,01,012,0128,01284,subclass,"Growing of perennial and non-perennial spices and aromatic crops (pepper, capsicum, nutmeg, mace, anise, badian and fennel, cinnamon (canella), cloves, vanilla and other spices and aromatic crops)"
A,01,012,0128,01285,subclass,Growing of drug and narcotic crops
A,01,012,0128,01286,subclass,"Growing of plants used primarily in perfumery, in pharmacy or for insecticidal, fungicidal or similar purposes"
A,01,012,0128,01287,subclass,Growing of heena leaves (mehendi)
A,01,012,0129,,class,Growing of other perennial crops
A,01,012,0129,01291,subclass,Growing of rubber trees
A,01,012,0129,01292,subclass,Growing of trees for extraction of sap
A,01,012,0129,01293,subclass,Growing of bamboo and cane
A,01,012,0129,01299,subclass,"Growing of other perennial crops, n.e.c."
A,01,013,,,group,Plant propagation
A,01,013,0130,,class,Plant propagation
A,01,013,0130,01301,subclass,Growing of plants for planting
A,01,014,,,group,Animal production
A,01,014,0141,,class,Raising of cattle and buffaloes
A,01,014,0141,01411,subclass,Raising and breeding of cattle and buffaloes
A,01,014,0141,01412,subclass,Production of milk from cows or buffaloes
A,01,014,0141,01413,subclass,Production of bovine semen
A,01,014,0142,,class,Raising of horses and other equines
A,01,014,0142,01420,subclass,Raising of horses and other equines
A,01,014,0143,,class,Raising and breeding of camels and camelids
A,01,014,0143,01430,subclass,Raising and breeding of camels and camelids
A,01,014,0144,,class,Raising of sheep and goats
A,01,014,0144,01441,subclass,Raising and breeding of sheep and goats
A,01,014,0144,01442,subclass,Production of milk from sheep or goat
A,01,014,0144,01443,subclass,Production of raw wool
A,01,014,0145,,class,Raising of swine/pigs
A,01,014,0145,01450,subclass,Raising of swine/pigs (including breeding of swine/pigs)
A,01,014,0146,,class,Raising of poultry
A,01,014,0146,01461,subclass,"Raising and breeding of chickens and capons, ducks, geese, turkeys and guinea fowls chickens and capons, ducks, geese, turkeys and guinea fowls"
A,01,014,0146,01462,subclass,Production of eggs
A,01,014,0146,01463,subclass,Operation of poultry hatcheries
A,01,014,0149,,class,Raising of other animals
A,01,014,0149,01491,subclass,"Raising and breeding of pet animals (cats, dogs, birds, hamsters etc.)"
A,01,014,0149,01492,subclass,Bee-keeping and production of honey and beeswax
A,01,014,0149,01493,subclass,"Raising of silk worms, production of silk worm cocoons"
A,01,014,0149,01499,subclass,"Raising of other animals, n.e.c."
A,01,015,,,group,Mixed farming
A,01,015,0150,,class,Mixed farming
A,01,015,0150,01500,subclass,Mixed farming
A,01,016,,,group,Support activities to agriculture and post-harvest crop activities
A,01,016,0161,,class,Support activities for crop production
A,01,016,0161,01611,subclass,"Agricultural activities on a fee or contract basis (preparation of fields, establishing a crop, treatment of crops, crop spraying, trimming of fruit trees and vines, transplanting of rice, thinning of beets, harvesting, pest control in connection wit"
A,01,016,0161,01612,subclass,Operation of agricultural irrigation equipment
A,01,016,0161,01619,subclass,Other supporting activities including agricultural gardening (excluding
A,01,016,0162,,class,Support activities for animal production
A,01,016,0162,01620,subclass,Support activities for animal production
A,01,016,0163,,class,Post-harvest crop activities
A,01,016,0163,01631,subclass,"Preparation of crops for primary markets, i.e. cleaning, trimming, grading, disinfecting"
A,01,016,0163,01632,subclass,"Cotton ginning, cleaning and bailing"
A,01,016,0163,01633,subclass,Preparation of tobacco leaves
A,01,016,0163,01639,subclass,"Other post harvest crop activities, n.e.c."
A,01,016,0164,,class,Seed processing for propagation
A,01,016,0164,01640,subclass,Seed processing for propagation
A,01,017,,,group,"Hunting, trapping and related service activities"
A,01,017,0170,,class,"Hunting, trapping and related service activities"
A,01,017,0170,01700,subclass,"Hunting, trapping and related service activities"
A,02,,,,division,Forestry and logging
A,02,021,,,group,Silviculture and other forestry activities
A,02,021,0210,,class,Silviculture and other forestry activities
A,02,021,0210,02101,subclass,"Growing of standing timber (planting, replanting, transplanting, thinning and conserving of forests and timber tracts)"
A,02,021,0210,02102,subclass,Operation of forest tree nurseries
A,02,021,0210,02109,subclass,"Other foresty activities including growing of pulpwood,firewood etc"
A,02,022,,,group,Logging
A,02,022,0220,,class,Logging
A,02,022,0220,02201,subclass,Gathering and preparation of fire wood
A,02,022,0220,02202,subclass,"Logging camps and loggers primarily engaged in felling timber and producing wood in the rough such as pitprops, split poles, pickets, hewn railway ties"
A,02,022,0220,02203,subclass,Production of charcoal in the forest (using traditional methods)
A,02,022,0220,02209,subclass,"Other logging activities, n.e.c."
A,02,023,,,group,Gathering of non-wood forest products
A,02,023,0230,,class,Gathering of non-wood forest products
A,02,023,0230,02301,subclass,Gathering of tendu leaves
A,02,023,0230,02302,subclass,"Gathering of lac, resins and rubber-like gums"
A,02,023,0230,02303,subclass,"Gathering of wild growing mushrooms, truffles, berries, nuts, cork, balsams, vegetable hair, eelgrass, mosses, lichens"
A,02,023,0230,02309,subclass,"Gathering of non-wood forest products, n.e.c."
A,02,024,,,group,Support services to forestry
A,02,024,0240,,class,Support services to forestry
A,02,024,0240,02401,subclass,"Forestry service activities (forest management consulting services, forestry inventories, timber evaluation, forest pest control)"
A,02,024,0240,02402,subclass,Logging service activities such as transport of logs within the forest
A,03,,,,division,Fishing and aquaculture
A,03,031,,,group,Fishing
A,03,031,0311,,class,Marine fishing
A,03,031,0311,03111,subclass,Fishing on a commercial basis including taking of marine crustaceans and molluscs in ocean and coastal waters
A,03,031,0311,03112,subclass,"Gathering of other marine organisms and materials such as natural pearls, sponges, coral and algae"
A,03,031,0311,03113,subclass,Activities of vessels engaged in fishing and in processing and preserving of fish
A,03,031,0312,,class,Freash water fishing
A,03,031,0312,03121,subclass,Fishing and taking of freshwater crustaceans and molluscs on a commercial basis in inland waters
A,03,031,0312,03122,subclass,Taking and gathering of freshwater aquatic animals
A,03,032,,,group,Aquaculture
A,03,032,0321,,class,Marine aquaculture
A,03,032,0321,03211,subclass,Fish farming in sea water including farming of marine ornamental fish
A,03,032,0321,03212,subclass,"Culture of crustaceans, bivalves, other mollusks and other aquatic animals in sea water"
A,03,032,0321,03213,subclass,Growing of edible seaweeds
A,03,032,0321,03214,subclass,Aquaculture activities in brackish waters and in salt water filled tanks or reservoirs
A,03,032,0321,03215,subclass,Operation of fish hatcheries (marine)
A,03,032,0321,03219,subclass,"Other marine aquaculture, n.e.c."
A,03,032,0322,,class,Freshwater aquaculture
A,03,032,0322,03221,subclass,Fish farming in freshwater including farming of freshwater ornamental fish
A,03,032,0322,03222,subclass,"Culture of freshwater crustaceans, bivalves, other mollusks and other aquatic animals"
A,03,032,0322,03223,subclass,Operation of fish hatcheries (fresh-water)
A,03,032,0322,03229,subclass,"Other freshwater aquaculture ctivities, n.e.c."
B,,,,,section,MINING AND QUARRYING
B,05,,,,division,Mining of coal and lignite
B,05,051,,,group,Mining of hard coal
B,05,051,0510,,class,Mining of hard coal
B,05,051,0510,05101,subclass,Opencast mining of hard coal
B,05,051,0510,05102,subclass,Belowground mining of hard coal
B,05,051,0510,05103,subclass,"Cleaning, sizing, grading, pulverizing, compressing etc. of coal"
B,05,051,0510,05109,subclass,Other operations relating to mining and agglomeration of hard coal
B,05,052,,,group,Mining of lignite
B,05,052,0520,,class,Mining of lignite
B,05,052,0520,05201,subclass,Opencast mining of lignite (brown coal)
B,05,052,0520,05202,subclass,Belowground mining of lignite (brown coal)
B,05,052,0520,05203,subclass,"Washing, dehydrating, pulverizing, compressing of lignite"
B,05,052,0520,05209,subclass,Other operations relating to mining and agglomeration of lignite
B,06,,,,division,Extraction of crude petroleum and natural gas
B,06,061,,,group,Extraction of crude petroleum
B,06,061,0610,,class,Extraction of crude petroleum
B,06,061,0610,06101,subclass,Off shore extraction of crude petroleum
B,06,061,0610,06102,subclass,On shore extraction of crude petroleum
B,06,062,,,group,Extraction of natural gas
B,06,062,0620,,class,Extraction of natural gas
B,06,062,0620,06201,subclass,Offshore Extraction of natural gas
B,06,062,0620,06202,subclass,On shore Extraction of natural gas
B,07,,,,division,Mining of metal ores
B,07,071,,,group,Mining of iron ores
B,07,071,0710,,class,Mining of iron ores
B,07,071,0710,07100,subclass,Mining of iron ores
B,07,072,,,group,Mining of non-ferrous metal ores
B,07,072,0721,,class,Mining of uranium and thorium ores
B,07,072,0721,07210,subclass,Mining of uranium and thorium ores
B,07,072,0729,,class,Mining of other non-ferrous metal ores
B,07,072,0729,07291,subclass,Mining of copper ore
B,07,072,0729,07292,subclass,Mining of aluminium ore (bauxite)
B,07,072,0729,07293,subclass,Mining of manganese ore
B,07,072,0729,07294,subclass,Mining of chromium ore
B,07,072,0729,07295,subclass,"Mining of precious metal ore (gold, silver)"
B,07,072,0729,07296,subclass,Mining of lead and znic ore
B,07,072,0729,07299,subclass,"Mining of other non-ferrous metal ores, n.e.c. [titanium (ilmenite and rutile),niobium, tantalum, vanadium or zirconium ores; tin bearing ores and, nickel, cobalt, tungsten, molybdenum, antimony and other non-ferrous metal ores]"
B,08,,,,division,Other Mining and quarrying
B,08,081,,,group,"Quarrying of stone, sand and clay"
B,08,081,0810,,class,"Quarrying of stone, sand and clay"
B,08,081,0810,08101,subclass,Quarrying of marble
B,08,081,0810,08102,subclass,Quarrying of granite
B,08,081,0810,08103,subclass,Quarrying of slate and building and monumental stone other than marble and granite
B,08,081,0810,08104,subclass,Mining of dolomite
B,08,081,0810,08105,subclass,Mining of gypsum including selenite
B,08,081,0810,08106,subclass,"Operation of sand or gravel pits, basalt/porphyry, clay (ordinary), crushing and breaking of stone for use as a flux or raw material in lime or cement, manufacture or as building material, road metal or ballast and other materials for construction"
B,08,081,0810,08107,subclass,"Mining/quarrying of limestone, limeshell, ‘kankar’ and other calcareous minerals including calcite, chalk and shale"
B,08,081,0810,08108,subclass,"Mining of clays (kaolin, ball clay, wollastonite, bentonite, fuller’s earth, fire clay etc.)"
B,08,081,0810,08109,subclass,"Mining of refractory non-clay minerals (andalusite, kyanite, sillimanite, dunite, diaspore magnesite, diaspore, magnesite)"
B,08,089,,,group,Mining and quarrying n.e.c.
B,08,089,0891,,class,Mining of chemical and fertilizer minerals
B,08,089,0891,08911,subclass,Mining of native sulphur or pyrites and pyrrhotites valued chiefly for sulphur
B,08,089,0891,08912,subclass,Mining of natural phosphates including apatite minerals
B,08,089,0891,08913,subclass,Mining of earth colours (ochre including red oxide).
B,08,089,0891,08914,subclass,Mining of fluorspar
B,08,089,0891,08915,subclass,Mining of barytes
B,08,089,0891,08919,subclass,Mining of potash bearing salts/minerals; borate minerals and other fertiliser and chemical minerals n.e.c.
B,08,089,0892,,class,Extraction and agglomeration of peat
B,08,089,0892,08920,subclass,Extraction and agglomeration of peat
B,08,089,0893,,class,Extraction of salt
B,08,089,0893,08931,subclass,"Salt mining, quarrying, screening etc."
B,08,089,0893,08932,subclass,Salt production by evaporation of sea water or other saline waters
B,08,089,0899,,class,Other mining and quarrying n.e.c.
B,08,089,0899,08991,subclass,"Mining of gemstones (agate, diamond, emerald, garnet (gem), jasper, rubby/saphire etc."
B,08,089,0899,08992,subclass,"Mining and quarrying of abrasive materials (pumice stone, emery, corundum, garnet and other natural abrasives)"
B,08,089,0899,08993,subclass,Mining of mica
B,08,089,0899,08994,subclass,Mining of natural graphite
B,08,089,0899,08995,subclass,Mining of asbestos
B,08,089,0899,08996,subclass,"Mining of vermiculite, perlite and chlorites"
B,08,089,0899,08997,subclass,"Mining of felspar and silica minerals including quartz, quartzite and fuch. Quartzite"
B,08,089,0899,08998,subclass,Mining of talc/steatite
B,08,089,0899,08999,subclass,"Mining of laterite, diatomite and silicious fossil meals (e.g. diatomite) and other natural fluxes, natural asphalt or bitumen and other mining n.e.c."
B,09,,,,division,Mining support service activities
B,09,091,,,group,Support activities for petroleum and natural gas mining
B,09,091,0910,,class,Support activities for petroleum and natural gas mining
B,09,091,0910,09101,subclass,Services incidental to off shore oil extraction
B,09,091,0910,09102,subclass,Services incidental to on shore oil extraction
B,09,091,0910,09103,subclass,Services incidental to off shore gas extraction
B,09,091,0910,09104,subclass,Services incidental to on shore gas extraction
B,09,099,,,group,Support activities for other mining and quarrying
B,09,099,0990,,class,Support activities for other mining and quarrying
B,09,099,0990,09900,subclass,Support activities for other mining and quarrying
C,,,,,section,MANUFACTURING
C,10,,,,division,Manufacture of food products
C,10,101,,,group,Processing and preserving of meat
C,10,101,1010,,class,Processing and preserving of meat
C,10,101,1010,10101,subclass,"Mutton-slaughtering, preparation"
C,10,101,1010,10102,subclass,"Beef-slaughtering, preparation"
C,10,101,1010,10103,subclass,"Pork-slaughtering, preparation"
C,10,101,1010,10104,subclass,"Poultry and other slaughtering, preparation"
C,10,101,1010,10105,subclass,"Preservation, Processing and canning of meat"
C,10,101,1010,10106,subclass,Production of hides and skins originating from slaughterhouses
C,10,101,1010,10107,subclass,Rendering of lard and other edible fats of animal origin; 10108;Production and processing of animal offal
C,10,101,1010,10109,subclass,"Production, processing and preserving of other meat and meat products n.e.c."
C,10,102,,,group,"Processing and preserving of fish, crustaceans and molluscs and products thereof"
C,10,102,1020,,class,"Processing and preserving of fish, crustaceans and molluscs and products thereof"
C,10,102,1020,10201,subclass,Sun-drying of fish
C,10,102,1020,10202,subclass,Artificial dehydration of fish and sea food
C,10,102,1020,10203,subclass,Radiation preservation of fish and similar food
C,10,102,1020,10204,subclass,Processing and preserving of fish crustacean and similar foods
C,10,102,1020,10205,subclass,Processing and canning of fish
C,10,102,1020,10206,subclass,Processing and canning of frog legs
C,10,102,1020,10207,subclass,Production of fishmeal for human consumption or animal feed
C,10,102,1020,10209,subclass,"Production, processing and preservation of other fish products n.e.c."
C,10,103,,,group,Processing and preserving of fruit and vegetables
C,10,103,1030,,class,Processing and preserving of fruit and vegetables
C,10,103,1030,10301,subclass,Sun-drying of fruit and vegetables
C,10,103,1030,10302,subclass,Artificial dehydration of fruit and vegetables
C,10,103,1030,10303,subclass,Radiation preservation of fruit and vegetables
C,10,103,1030,10304,subclass,"Manufacture of fruit or vegetable juices and their concentrates, squashes and powder"
C,10,103,1030,10305,subclass,"Manufacture of sauces, jams, jellies and marmalades"
C,10,103,1030,10306,subclass,"Manufacture of pickles, chutney etc."
C,10,103,1030,10307,subclass,Canning of fruits and vegetables
C,10,103,1030,10308,subclass,Manufacture of potato flour & meals and prepared meals of vegetables
C,10,103,1030,10309,subclass,Preservation of fruit and vegetables n.e.c.
C,10,104,,,group,Manufacture of vegetable and animal oils and fats
C,10,104,1040,,class,Manufacture of vegetable and animal oils and fats
C,10,104,1040,10401,subclass,Manufacture of hydrogenated oil and vanaspati ghee
C,10,104,1040,10402,subclass,Manufacture of vegetable oils and fats excluding corn oil
C,10,104,1040,10403,subclass,Manufacture of edible animal oils and fats
C,10,104,1040,10404,subclass,Manufacture of fish oil
C,10,104,1040,10405,subclass,Manufacture of non-edible animal oil and fats
C,10,104,1040,10406,subclass,"Manufacture of oil cakes & meals incl. residual products, e.g. Oleostearin, Palmstearin"
C,10,104,1040,10407,subclass,"Manufacture of non-defatted flour or meals of oilseeds, oilnuts or kernels"
C,10,104,1040,10409,subclass,"Manufacture of other vegetable oil, animal oil and fats n.e.c"
C,10,105,,,group,Manufacture of dairy products
C,10,105,1050,,class,Manufacture of dairy products
C,10,105,1050,10501,subclass,Manufacture of pasteurised milk whether or not in bottles/ polythene packs etc. (plain or flavoured)
C,10,105,1050,10502,subclass,"Manufacture of milk-powder, ice-cream powder and condensed milk except baby milk food"
C,10,105,1050,10503,subclass,Manufacture of baby milk foods
C,10,105,1050,10504,subclass,"Manufacture of cream, butter, cheese, curd, ghee, khoya etc."
C,10,105,1050,10505,subclass,"Manufacture of ice-cream, kulfi etc."
C,10,105,1050,10509,subclass,Manufacture of other dairy products n.e.c.
C,10,106,,,group,"Manufacture of grain mill products, starches and starch products"
C,10,106,1061,,class,Manufacture of grain mill products
C,10,106,1061,10611,subclass,Flour milling
C,10,106,1061,10612,subclass,Rice milling
C,10,106,1061,10613,subclass,Dal (pulses) milling
C,10,106,1061,10614,subclass,"Grain milling other than wheat, rice and dal"
C,10,106,1061,10615,subclass,"Vegetable milling (production of flour or meal of dried leguminous vegetables(except dal), of roots or tubers, or of edible nuts)"
C,10,106,1061,10616,subclass,Manufacture of cereal breakfast foods obtained by roasting or swelling cereal grains
C,10,106,1061,10617,subclass,"Manufacture of flour mixes and prepared blended flour and dough for bread, cakes, biscuits"
C,10,106,1061,10618,subclass,"Manufacture of other readymade mixed powders like idli, gulabjamun etc."
C,10,106,1061,10619,subclass,Other grain milling and processing n.e.c.
C,10,106,1062,,class,Manufacture of starches and starch products
C,10,106,1062,10621,subclass,"Manufacture of starches from rice, potatoes, maize etc."
C,10,106,1062,10622,subclass,Manufacture of sago and sago products
C,10,106,1062,10623,subclass,"Manufacture of glucose, glucose syrup, maltose etc."
C,10,106,1062,10624,subclass,Manufacture of gluten
C,10,106,1062,10625,subclass,Manufacture of tapioca and tapioca substitutes prepared from starch
C,10,106,1062,10626,subclass,Manufacture of corn oil
C,10,106,1062,10629,subclass,Manufacture of other starch products n.e.c.
C,10,107,,,group,Manufacture of other food products
C,10,107,1071,,class,Manufacture of bakery products
C,10,107,1071,10711,subclass,Manufacture of bread
C,10,107,1071,10712,subclass,"Manufacture of biscuits, cakes, pastries, rusks etc."
C,10,107,1071,10719,subclass,Manufacture of other bakery products n.e.c.
C,10,107,1072,,class,Manufacture of sugar
C,10,107,1072,10721,subclass,Manufacture or refining of sugar (sucrose) from sugercane
C,10,107,1072,10722,subclass,Manufacture of `gur’ from sugarcane
C,10,107,1072,10723,subclass,Manufacture of `gur’ from other than sugarcane
C,10,107,1072,10724,subclass,Manufacture of `khandsari’ sugar from sugarcane
C,10,107,1072,10725,subclass,Manufacture of `khandsari’ suger from other than sugarcane
C,10,107,1072,10726,subclass,Manufacture of `boora’ and candy from sugarcane
C,10,107,1072,10727,subclass,Manufacture of `boora’ and candy from other than sugarcane
C,10,107,1072,10728,subclass,Manufacture of molasses
C,10,107,1072,10729,subclass,"Manufacture of sugar from other sources (juice of palm, suger beet etc.)"
C,10,107,1073,,class,"Manufacture of cocoa, chocolate and sugar confectionery"
C,10,107,1073,10731,subclass,Manufacture of cocoa products
C,10,107,1073,10732,subclass,Manufacture of chocolate and chocolate confectionery
C,10,107,1073,10733,subclass,Manufacture of sugar confectionery (except sweetmeats)
